company,email,verified,contact_name,custom_line
Climaventia,info@climaventia.es,yes,,"Vi que cubrís climatización, ventilación y aerotermia en Bilbao y toda Vizcaya."
Clima Norte,info@climanorte.com,yes,,"Lleváis más de 50 años trabajando en Bizkaia y la zona norte."
Aidesegi,info@aidesegi.com,yes,,"Sé que trabajáis con ingeniería propia para instalaciones a medida."
MasterClim,info@masterclim.es,yes,,"Lleváis más de 10 años con climatización y fontanería en Bilbao."
Klima Fadura,info@klimafadura.com,yes,,"Sois una referencia del aire acondicionado en Getxo y la comarca."
Girolan,info@girolan.net,yes,,"Lleváis más de 35 años en climatización en Gipuzkoa."
Klimagas,info@klimagas.es,yes,,"Trabajáis climatización en Donostia, Irún y todo Gipuzkoa."
Climatec Bidasoa,info@climatecbidasoa.com,yes,,"Cubrís la zona del Bidasoa, Irún y Donostia."
Izurzu Clima,info@izurzuclima.com,yes,,"Dais servicio de climatización en toda Navarra."
Complet Clima,info@completclima.com,yes,,"Trabajáis para hogar y negocio en Pamplona y Navarra."
Delaire 2000,delaire2000@delaire2000.es,yes,,"Lleváis años instalando aire acondicionado por toda la Comunidad de Madrid."
Mancliar,mancliar@mancliar.com,yes,,"Trabajáis climatización y aire acondicionado en Zaragoza."
BP Climatización,contacto@bpclimatizacion.com,yes,,"Instaláis aire acondicionado y bomba de calor en Zaragoza y Huesca."
TS Clima,info@tsclima.es,yes,,"Instaláis aire acondicionado en Valencia y alrededores."
Electroclima Levante,electroclima@electro-clima.es,yes,,"Sois un referente de la climatización en la Comunidad Valenciana."
Morera Clima,holamoreraclima@gmail.com,yes,,"Trabajáis el aire acondicionado en Barcelona."
Air-Mant,airmant@airmant.com,yes,,"Dais servicio técnico de aire acondicionado en Barcelona."
MD Climatizaciones,info@mdclimatizacionesyestructuras.com,yes,,"Trabajáis climatización y baja tensión en Barcelona."
Climalaga,info@climalaga.es,yes,,"Lleváis desde 1998 con el servicio técnico de aire acondicionado en Málaga."
Norclima,norclima@norclima.es,yes,,"Lleváis más de 30 años en climatización en Santander."
Inteco Rioja,inteco@intecorioja.es,yes,,"Sois expertos en climatización y fontanería en Logroño."
Ecoenergía Asturias,info@ecoenergiaasturias.com,yes,,"Instaláis aire acondicionado y soluciones de eficiencia en Gijón y Asturias."
Instalaciones Tuero,instatuero@gmail.com,yes,,"Trabajáis la instalación y el mantenimiento de aire acondicionado en Asturias."
Climaire Galicia,info@climairegalicia.com,yes,,"Trabajáis climatización y aerotermia en Vigo."
Quinfrio,info@quinfrio.com,yes,,"Trabajáis el aire acondicionado en Valladolid."
Frío Morales,friomorales@friomorales.es,yes,,"Lleváis la refrigeración y la climatización en Valladolid y Castilla y León."
Euroclima,info@euroclima.info,yes,,"Lleváis más de 20 años en climatización en Córdoba."
Ega Clima,info@egaclima2012.com,yes,,"Dais servicio técnico de climatización en Granada, Jaén y Córdoba."
